date,headline,ormas,sentiment,headline_stem
2023-04-08 03:10:00,PKB Sulsel Kekeh Libatkan Kader Muhammadiyah di Tim UKK Meski Ambo Asse Batal,Muhammadiyah,Neutral,pkb sulsel kekeh libat kader muhammadiyah di tim ukk meski ambo asse batal
2023-04-13 10:31:00,Kapan Sidang Isbat Lebaran Idul Fitri 2023? Cek Jadwalnya di Sini!,Ormas Saja,Neutral,kapan sidang isbat lebaran idul fitri 2023 cek jadwal di sini
2023-04-02 15:19:00,Tolak Timnas Israel di Pildun U-20 Paradoks Terheboh-Melukis Diri Sendiri,Ormas Saja,Negative,tolak timnas israel di pildun u-20 paradoks terheboh-melukis diri sendiri
2023-04-02 13:00:00,Saat Sekum MUI Sukabumi Tenteng Senjata dan Bikin Gaduh,Ormas Saja,Negative,saat sekum mui sukabumi tenteng senjata dan bikin gaduh
2023-04-02 13:00:00,Paradoks Indonesia Saat Batal Jadi Tuan Rumah Piala Dunia U-20 2023,Ormas Saja,Negative,paradoks indonesia saat batal jadi tuan rumah piala dunia u-20 2023
2023-04-09 20:45:00,"Polemik Gagal Pildun, Kasatkornas Banser: Jangan Ada Adu Domba",Ormas Saja,Negative,polemik gagal pildun kasatkornas banser jangan ada adu domba
2023-04-06 20:18:00,Tampang Anggota Geng Motor Pembacok Sadis Pria Sukabumi,Ormas Saja,Negative,tampang anggota geng motor bacok sadis pria sukabumi
2023-04-03 22:00:00,Jabar Hari Ini: Trik Licik Sunjaya hingga Pembacok Sadis Ditangkap,Ormas Saja,Negative,jabar hari ini trik licik sunjaya hingga bacok sadis tangkap
2014-05-28 19:10:00,"Di Hadapan Jokowi, Ketua PBNU Sebut NU Tak Seperti Ormas Lain",Nahdlatul Ulama (NU),Neutral,di hadap jokowi ketua pbnu sebut nu tak seperti ormas lain
2023-04-09 11:10:00,Karpet Merah Anas Urbaningrum Selepas Bebas dari Jeruji Besi,Ormas Saja,Neutral,karpet merah anas urbaningrum lepas bebas dari jeruji besi
2023-04-14 13:49:00,Apa Itu Hilal dan Kapan Penentuan Hilal Lebaran Idul Fitri 2023?,Ormas Saja,Neutral,apa itu hilal dan kapan tentu hilal lebaran idul fitri 2023
2023-04-12 16:15:00,Yaqut Hadiri Pembukaan Acara Santunan Yatim Ramadan Berkah Kemenag,Ormas Saja,Positive,yaqut hadir buka acara santun yatim ramadan berkah kemenag
2023-03-31 22:24:00,"Sosialisasi 4 Pilar Kebangsaan, HNW Ingatkan Keteladanan Pendiri Bangsa",Ormas Saja,Positive,sosialisasi 4 pilar bangsa hnw ingat teladan diri bangsa
2023-03-22 11:33:00,Kapan Sidang Isbat Awal Ramadhan 2023? Ini Jadwal dan Titik Pemantauan Hilal,Ormas Saja,Neutral,kapan sidang isbat awal ramadhan 2023 ini jadwal dan titik pantau hilal
2023-04-11 14:15:00,"Anas Urbaningrum Disambut Loyalis, Ini Kata Pakar Unpad",Ormas Saja,Neutral,anas urbaningrum sambut loyalis ini kata pakar unpad
2023-03-21 12:19:00,Jadwal Sidang Isbat Ramadhan 2023 dan Titik Pemantauan Hilal,Ormas Saja,Neutral,jadwal sidang isbat ramadhan 2023 dan titik pantau hilal
2023-04-10 08:20:00,100 Ton Kurma dari Raja Salman Dibagikan ke Tokoh Agama hingga Ponpes,Ormas Saja,Positive,100 ton kurma dari raja salman bagi ke tokoh agama hingga ponpes
2023-04-04 02:00:00,NasDem Sumut Ditinggal 2 Eks Ketua Jelang Pemilu 2024,Ormas Saja,Negative,nasdem sumut tinggal 2 eks ketua jelang milu 2024
2023-04-12 11:25:00,Kapan Sidang Isbat Idul Fitri 2023? Catat Tanggalnya!,Ormas Saja,Neutral,kapan sidang isbat idul fitri 2023 catat tanggal
2014-05-28 15:02:00,Peran Ormas Islam Dalam Mencerdaskan Bangsa,Ormas Islam,Positive,peran ormas islam dalam cerdas bangsa
2023-04-13 12:00:00,Sidang Isbat Lebaran 2023 Tanggal Berapa? Simak Jadwalnya,Ormas Saja,Neutral,sidang isbat lebaran 2023 tanggal berapa simak jadwal
2023-04-06 18:00:00,Nasdem Jabar Bicara Soal Peluang Farhan Maju Bursa Pilwakot Bandung,Ormas Saja,Neutral,nasdem jabar bicara soal peluang farhan maju bursa pilwakot bandung
2023-03-28 06:11:00,"Dukung Gus Yahya, Para Guru Besar Siap Globalkan Fikih Peradaban",Ormas Saja,Positive,dukung gus yahya para guru besar siap global fikih adab
2023-03-27 12:00:00,8 Fakta Video Tenteng Senjata Sekum MUI Sukabumi Berujung Maaf,Ormas Saja,Negative,8 fakta video tenteng senjata sekum mui sukabumi ujung maaf
2023-04-09 17:08:00,Indonesia Terima Hibah 100 Ton Kurma dari Raja Salman,Ormas Saja,Positive,indonesia terima hibah 100 ton kurma dari raja salman
2023-03-21 14:00:00,124 Lokasi Pengamatan Hilal untuk Sidang Isbat Ramadan 2023,Ormas Saja,Neutral,124 lokasi amat hilal untuk sidang isbat ramadan 2023
2023-04-08 06:50:00,Tampang Pria di Bengkayang Perkosa ABG hingga Hamil 5 Bulan,Ormas Saja,Negative,tampang pria di bengkayang perkosa abg hingga hamil 5 bulan
2023-03-24 07:47:00,Fakta-fakta Penusukan Maut Saat Pawai Ogoh-ogoh di Jalan Veteran Denpasar,Nahdlatul Ulama (NU),Negative,fakta tusuk maut saat pawai ogoh-ogoh di jalan veteran denpasar
2023-04-03 17:12:00,"Profil Dito Ariotedjo Menpora Baru, Menteri Termuda di Kabinet Jokowi",Ormas Saja,Neutral,profil dito ariotedjo menpora baru menteri muda di kabinet jokowi
2023-04-06 06:44:00,Kemenkumham Tak Siapkan Pengamanan Khusus Saat Anas Urbaningrum Bebas,Ormas Saja,Neutral,kemenkumham tak siap aman khusus saat anas urbaningrum bebas
2014-05-22 19:19:00,Ratusan Warga dan Ormas Dukung Penutupan Dolly,Nahdlatul Ulama (NU),Positive,ratus warga dan ormas dukung tutup dolly
2023-03-30 03:30:00,7 Fakta Kapolres Kulon Progo Dicopot Usai Patung Bunda Maria Ditutup Terpal,Ormas Saja,Negative,7 fakta kapolres kulon progo copot usai patung bunda maria tutup terpal
2023-04-09 08:00:00,PKB Sulsel Libatkan Muhammadiyah di Tim UKK Bacaleg: Kita Politik Akomodatif,Muhammadiyah,Positive,pkb sulsel libat muhammadiyah di tim ukk bacaleg kita politik akomodatif
2023-03-29 19:30:00,"Polemik Timnas Israel U-20, Pakar UGM: Olahragawan Jangan Disangkutkan Politik",Ormas Saja,Negative,polemik timnas israel u-20 pakar ugm olahragawan jangan sangkut politik
2023-03-29 18:08:00,MAKI Bawa Kumpulan Berita Dugaan Gratifikasi Lili Pintauli di Praperadilan,Ormas Saja,Negative,maki bawa kumpul berita duga gratifikasi lili pintauli di praperadilan
2023-03-10 16:47:00,Kapan Awal Ramadhan 2023? Ini Jadwal Sidang Isbat dan Titik Pemantauan Hilal,Ormas Saja,Neutral,kapan awal ramadhan 2023 ini jadwal sidang isbat dan titik pantau hilal
2023-04-11 12:31:00,Sidang Isbat Penetapan Lebaran 2023 Digelar 20 April 2023,Ormas Saja,Neutral,sidang isbat tetap lebaran 2023 gelar 20 april 2023
2023-03-22 07:00:00,"Penentuan Awal Puasa Ramadan 2023 Gunakan Dua Metode, Apa Saja?",Ormas Saja,Neutral,tentu awal puasa ramadan 2023 guna dua metode apa saja
2023-04-11 10:53:00,Sidang Isbat Penentuan Idul Fitri 1444 H Digelar 20 April 2023,Ormas Saja,Neutral,sidang isbat tentu idul fitri 1444 h gelar 20 april 2023
2023-03-28 17:15:00,"Daftar Cuti Bersama dan Libur Lebaran 2023, 1 Syawal 1444 H Kapan?",Ormas Saja,Neutral,daftar cuti sama dan libur lebaran 2023 1 syawal 1444 h kapan
2023-03-28 16:30:00,Sikap Pasrah Sekum MUI yang Viral gegara Tenteng Senjata,Ormas Saja,Negative,sikap pasrah sekum mui yang viral gegara tenteng senjata
2014-05-14 17:25:00,Penutupan Lokalisasi Dolly Didukung Ormas Islam,Nahdlatul Ulama (NU),Positive,tutup lokalisasi dolly dukung ormas islam
2023-03-28 14:36:00,KPK dan Dewas Kompak Tolak Gugatan MAKI soal Penghentian Kasus Lili Pintauli,Ormas Saja,Neutral,kpk dan dewas kompak tolak gugat maki soal henti kasus lili pintauli
2023-03-28 09:30:00,Saat Ridwan Kamil Soroti Aksi Sekum MUI Sukabumi,Ormas Saja,Negative,saat ridwan kamil sorot aksi sekum mui sukabumi
2023-03-08 11:45:00,Jadwal Sidang Isbat Awal Ramadhan 2023 dan Daftar Titik Pemantauan Hilal,Ormas Saja,Neutral,jadwal sidang isbat awal ramadhan 2023 dan daftar titik pantau hilal
2023-03-27 14:41:00,"Viral Calon DKM Al Jabbar Tenteng Senjata, RK: Bisa Dievaluasi",Ormas Saja,Negative,viral calon dkm al jabbar tenteng senjata rk bisa evaluasi
2023-04-03 13:47:00,AMP Bali Dapat Intimidasi dari PGN Saat Akan Unjuk Rasa,Ormas Saja,Negative,amp bal dapat intimidasi dari pgn saat akan unjuk rasa
2023-03-31 11:36:00,"Sebut FIFA Bersikap Diskriminatif, HNW Dorong Indonesia 'Melawan'",Ormas Saja,Negative,sebut fifa sikap diskriminatif hnw dorong indonesia lawan
2023-04-03 09:49:00,"Jokowi Dilema Soal Batalnya Piala Dunia U20, Mahfud: Dunia Politik Harus Maklum",Ormas Saja,Negative,jokowi dilema soal batal piala dunia u20 mahfud dunia politik harus maklum
2023-04-07 02:30:00,Bebasnya Anas Urbaningrum Bakal Disambut Tokoh Negara-Anggota DPR,Ormas Saja,Neutral,bebas anas urbaningrum bakal sambut tokoh negara-anggota dpr
2023-03-30 20:54:00,"Masuk Tim UKK PKB, Ketua Muhammadiyah Sulsel Ngaku Tak Pernah Dikonfirmasi",Muhammadiyah,Neutral,masuk tim ukk pkb ketua muhammadiyah sulsel ngaku tak pernah konfirmasi
2023-04-24 10:29:00,"Ormas Bersajam Acak-acak Foodtruck Mi Aceh di Jaksel, Diduga Ribut THR",Ormas Saja,Negative,ormas bersajam acak foodtruck mi aceh di jaksel duga ribut thr
2014-05-07 08:39:00,"Dua Ormas Terlibat Bentrok, Satu Orang Kritis",Ormas Saja,Negative,dua ormas libat bentrok satu orang kritis
2023-03-30 09:00:00,Mengingat Kembali Siapa yang Tolak Timnas Israel-RI Gagal Gelar Piala Dunia,Ormas Saja,Negative,ingat kembali siapa yang tolak timnas israel-ri gagal gelar piala dunia
2023-03-16 10:34:00,"Sentil Balik Hasto, PD Bandingkan Subsidi Pro Rakyat Era SBY hingga Mega",Ormas Saja,Negative,sentil balik hasto pd banding subsidi pro rakyat era sby hingga mega
2023-03-22 17:46:00,Beda Metode Penentuan Awal Puasa Ramadan 2023 antara NU dan Muhammadiyah,Nahdlatul Ulama (NU),Neutral,beda metode tentu awal puasa ramadan 2023 antara nu dan muhammadiyah
2023-03-27 16:06:00,PP Persis Bersyukur Kepercayaan Publik ke Polri Naik: Kapolri Konsisten,Pemuda Pancasila (PP),Positive,pp persis syukur percaya publik ke polri naik kapolri konsisten
2023-03-27 15:28:00,"JK Sodorkan Cawapres untuk Anies, NasDem Jatim Akui Khofifah Masuk Kriteria",Ormas Saja,Neutral,jk sodor cawapres untuk anies nasdem jatim aku khofifah masuk kriteria
2023-03-13 13:00:00,Tantangan Profesionalisme Penyelenggara Pemilu 2024,Ormas Saja,Neutral,tantang profesionalisme selenggara milu 2024
2023-03-13 11:10:00,Berapa Hari Lagi Puasa Ramadhan 2023? Cek Tanggalnya!,Ormas Saja,Neutral,berapa hari lagi puasa ramadhan 2023 cek tanggal
2023-02-13 12:03:00,Ajaib! Bayi 7 Bulan Selamat Usai Terjebak Reruntuhan 139 Jam,Ormas Saja,Positive,ajaib bayi 7 bulan selamat usai jebak runtuh 139 jam
2023-03-21 22:26:00,Wagub Emil Beri Sinyal Positif Rencana Reaktivasi Rel KA di Madura,Ormas Saja,Positive,wagub emil beri sinyal positif rencana reaktivasi rel ka di madura
2023-03-22 17:55:00,Menag Terima Paparan Posisi Hilal Awal Ramadan Jelang Sidang Isbat,Ormas Saja,Neutral,menag terima papar posisi hilal awal ramadan jelang sidang isbat
2014-05-06 10:27:00,"Massa Rusak Rumah Ketua Ormas, 25 Orang Diamankan",Ormas Saja,Negative,massa rusak rumah ketua ormas 25 orang aman
2023-03-21 06:40:00,Ngabalin Sindir PA 212 yang Tolak Timnas Israel ke RI: di Mana Logikanya?,Persaudaraan Alumni 212 (PA 212),Negative,ngabalin sindir pa 212 yang tolak timnas israel ke ri di mana logika
2023-04-08 06:00:00,Bejatnya Pria di Bengkayang Kalbar Perkosa ABG hingga Hamil 5 Bulan,Ormas Saja,Negative,bejat pria di bengkayang kalbar perkosa abg hingga hamil 5 bulan
2023-03-31 09:31:00,3 Fakta Tentang AKBP Fajarini Dicopot Usai Geger Patung Bunda Maria Diterpal,Ormas Saja,Negative,3 fakta tentang akbp fajarini copot usai geger patung bunda maria terpal
2023-04-03 11:31:00,Polisi Tangkap 3 Anggota Pemuda Pancasila yang Serang RS Adam Malik,Ormas Saja,Negative,polisi tangkap 3 anggota pemuda pancasila yang serang rs adam malik
2023-04-04 12:49:00,Jalan Dakwah Kompol Andi Ali Sampaikan Pesan Kamtibmas di Sulsel,Ormas Saja,Positive,jalan dakwah kompol andi ali sampai pesan kamtibmas di sulsel
2023-03-19 19:57:00,"Kapan Mulai Puasa? Jadwal Ramadhan 2023 Versi Kemenag, Muhammadiyah dan NU",Nahdlatul Ulama (NU),Neutral,kapan mulai puasa jadwal ramadhan 2023 versi kemenag muhammadiyah dan nu
2023-04-02 14:20:00,Dicopotnya Kapolres Kulon Progo Usai Geger Patung Bunda Maria Diterpal,Ormas Saja,Negative,copot kapolres kulon progo usai geger patung bunda maria terpal
2023-03-18 15:40:00,"Anies Ungkit Politik Identitas di Pilkada 2017, PPP: Perlu Diproposionalkan",Pemuda Pancasila (PP),Negative,anies ungkit politik identitas di pilkada 2017 ppp perlu diproposionalkan
2023-03-30 00:03:00,"Bobby Perintahkan Gratis, Warga Parkir di Ramadhan Fair Masih Berbayar",Ormas Saja,Negative,bobby perintah gratis warga parkir di ramadhan fair masih bayar
2023-04-02 06:01:00,"Bertemu LDII, Bupati Ipuk Sinergikan Penanganan Masalah Sosial",Ormas Saja,Positive,temu ldii bupati ipuk sinergi tangan masalah sosial
2014-04-29 10:00:00,Ormas dan Satpol PP Gerebek Gudang Minuman Keras,Pemuda Pancasila (PP),Negative,ormas dan satpol pp gerebek gudang minum keras
2023-03-08 16:20:00,HNW Minta Kemenpora-PSSI Tolak Israel Berlaga di Piala Dunia U-20 2023,Ormas Saja,Negative,hnw minta kemenpora-pssi tolak israel laga di piala dunia u-20 2023
2023-03-30 08:33:00,"Indonesia Batal Tuan Rumah Piala Dunia U-20, Bupati Trenggalek: Posoku Ambyar!",Ormas Saja,Negative,indonesia batal tuan rumah piala dunia u-20 bupati trenggalek poso ambyar
2023-03-29 10:53:00,Fakta dan Ahistoris Pisahkan Olahraga dari Politik,Ormas Saja,Neutral,fakta dan ahistoris pisah olahraga dari politik
2023-03-07 10:30:00,Ma'ruf Tegaskan Komitmen Pemerintah Ajarkan Pancasila ke WNI di Luar Negeri,Ormas Saja,Positive,ma ruf tegas komitmen perintah ajar pancasila ke wni di luar negeri
2023-03-29 20:49:00,"PKL di Tangerang Resah Dimintai THR, 7 Orang Ditangkap Polisi",Ormas Saja,Negative,pkl di tangerang resah minta thr 7 orang tangkap polisi
2023-03-29 15:14:00,"Ini Sosok AKBP Nunuk Setiyowati, Kapolres Kulon Progo yang Baru",Nahdlatul Ulama (NU),Neutral,ini sosok akbp nunuk setiyowati kapolres kulon progo yang baru
2023-03-17 00:30:00,Gubernur Khofifah Ucapkan Selamat ke Putri Wapres yang Jadi Gubes Unesa,Nahdlatul Ulama (NU),Positive,gubernur khofifah ucap selamat ke putri wapres yang jadi gubes unesa
2023-03-22 13:49:00,HNW Puji Sikap PDIP Tolak Timnas Israel di Piala Dunia U-20,Ormas Saja,Positive,hnw puji sikap pdip tolak timnas israel di piala dunia u-20
2023-03-16 12:31:00,Kalender Hari Terakhir Bulan Syaban dan Awal Ramadhan 2023,Ormas Saja,Neutral,kalender hari akhir bulan syaban dan awal ramadhan 2023
2023-03-22 15:04:00,Hasil Sidang Isbat 2023 Diumumkan Kapan? Ini Jadwal dan Live Streaming,Ormas Saja,Neutral,hasil sidang isbat 2023 umum kapan ini jadwal dan live streaming
2014-04-13 10:57:00,Ormas Islam bersama Warga Sweeping dan Usir Pengikut Aliran yang Dianggap Sesat,Ormas Islam,Negative,ormas islam sama warga sweeping dan usir ikut alir yang anggap sesat
2023-03-22 12:01:00,Sidang Isbat 2023 Jam Berapa? Ini Jadwalnya dan Link Live Streaming,Ormas Saja,Neutral,sidang isbat 2023 jam berapa ini jadwal dan link live streaming
2023-03-21 20:01:00,"Sidang Isbat Awal Ramadan Digelar Kemenag pada Rabu, 22 Maret 2023",Ormas Saja,Neutral,sidang isbat awal ramadan gelar kemenag pada rabu 22 maret 2023
2023-04-02 08:55:00,Kriminal Bali: Duel Guru dan Murid-Rektor Unud Ajukan Praperadilan,Ormas Saja,Negative,kriminal bal duel guru dan murid-rektor unud aju praperadilan
2023-03-21 14:04:00,Sidang Isbat Awal Ramadan 2023: Link Live Streaming dan Jadwalnya,Ormas Saja,Neutral,sidang isbat awal ramadan 2023 link live streaming dan jadwal
2023-03-21 14:40:00,"Rapimnas Dinilai Janggal, PW DMI Jateng Soroti Penundaan Muktamar VIII",Ormas Saja,Negative,rapimnas nilai janggal pw dmi jateng sorot tunda muktamar viii
2023-03-27 09:45:00,Kontroversi Video Sekum MUI Sukabumi: Bawa Senjata-Narasi Provokatif,Ormas Saja,Negative,kontroversi video sekum mui sukabumi bawa senjata-narasi provokatif
2023-04-03 16:10:00,LBH Bali Kecam Polisi 'Biarkan' Bentrokan AMP Vs PGN,Ormas Saja,Negative,lbh bal kecam polisi biar bentrok amp vs pgn
2023-03-20 17:15:00,Korban Pembacokan Sadis di Sukabumi Diketahui Baru Pulang Papajar,Ormas Saja,Negative,korban baco sadis di sukabumi tahu baru pulang papajar
2023-03-27 15:49:00,RK Evaluasi Kepengurusan Masjid Al Jabbar Usai Calon DKM Tenteng Senjata,Ormas Saja,Negative,rk evaluasi urus masjid al jabbar usai calon dkm tenteng senjata
2023-04-03 09:23:00,Pelaku Pembacokan Horor Pria di Sukabumi Ditangkap!,Ormas Saja,Negative,laku baco horor pria di sukabumi tangkap
2014-04-03 08:46:00,Warga dan Ormas Saling Serang,Ormas Saja,Negative,warga dan ormas saling serang
2023-03-26 20:38:00,Respons Wagub Uu soal Calon DKM Al Jabbar Viral Tenteng Senjata,Ormas Saja,Negative,respons wagub uu soal calon dkm al jabbar viral tenteng senjata
2023-03-27 11:43:00,"Piala Dunia U-20, Yandri Susanto: Timnas Israel Pantas untuk Ditolak",Ormas Saja,Negative,piala dunia u-20 yandri susanto timnas israel pantas untuk tolak
2023-02-11 09:17:00,"Erdogan Akui Bantuan Tak Secepat Diinginkan, Assad Kunjungi Korban Gempa",Ormas Saja,Negative,erdogan aku bantu tak cepat ingin assad kunjung korban gempa
2023-03-22 07:00:00,Kemenag Gelar Sidang Isbat Awal Ramadan 1444 Hijriah Hari Ini,Ormas Saja,Neutral,kemenag gelar sidang isbat awal ramadan 1444 hijriah hari ini
2023-03-23 16:12:00,Sadis! Eka Tewas Ditusuk Membabi Buta di Depan Istri-Dua Anaknya,Ormas Saja,Negative,sadis eka tewas tusuk babi buta di depan istri-dua anak
2023-03-26 11:02:00,Terpopuler Sepekan: Timnas Israel Ditolak di RI hingga 8 Masjid Tertua di Dunia,Ormas Saja,Negative,populer pek timnas israel tolak di ri hingga 8 masjid tua di dunia
2023-03-21 14:20:00,"Kemenag Gelar Sidang Isbat Awal Ramadan Besok, Ini 124 Titik Pemantauan Hilal",Ormas Saja,Neutral,kemenag gelar sidang isbat awal ramadan besok ini 124 titik pantau hilal
2023-02-20 05:30:00,"Ustaz Hanan Attaki 7 Kali Ditolak Ceramah di Jatim, Ini Daftarnya",Ormas Saja,Negative,ustaz hanan attaki 7 kali tolak ceramah di jatim ini daftar
2023-03-18 11:07:00,"Pengurus Golkar Jatim Bertemu Keuskupan Surabaya, ini yang Dibahas",Ormas Saja,Neutral,urus golkar jatim temu uskup surabaya ini yang bahas
2023-03-24 16:02:00,"Patung Bunda Maria Ditutup Terpal Viral, Ketua RT: Dari Dulu Aman-aman Saja",Ormas Saja,Neutral,patung bunda maria tutup terpal viral ketua rt dari dulu aman saja
2014-02-28 07:51:00,Puluhan Anggota Ormas Islam Saling Dorong dengan Brimob,Ormas Islam,Negative,puluh anggota ormas islam saling dorong dengan brimob
2023-02-18 13:43:00,Duduk Perkara Ustaz Hanan Attaki Ditolak Ceramah di 7 Daerah Jatim,Ormas Saja,Negative,duduk perkara ustaz hanan attaki tolak ceramah di 7 daerah jatim
2023-03-21 18:28:00,Kasus Pembacokan Pria di Sukabumi Mulai Terang Benderang,Ormas Saja,Negative,kasus baco pria di sukabumi mulai terang benderang
2023-03-21 16:42:00,Jadwal dan Link Live Streaming Sidang Isbat Ramadan 2023,Ormas Saja,Neutral,jadwal dan link live streaming sidang isbat ramadan 2023
2023-03-31 17:26:00,RS Adam Malik Digeruduk Pemuda Pancasila,Ormas Saja,Negative,rs adam malik digeruduk pemuda pancasila
2023-03-31 19:30:00,"Digeruduk Pemuda Pancasila, Pelayanan RS Adam Malik Terganggu",Ormas Saja,Negative,digeruduk pemuda pancasila layan rs adam malik ganggu
2023-03-30 09:15:00,Penolak Timnas Israel di Piala Dunia U-20 2023,Ormas Saja,Negative,tolak timnas israel di piala dunia u-20 2023
2023-03-08 17:47:00,Walkot Mojokerto Targetkan 0% Stunting & Kemiskinan Ekstrem di 2024,Ormas Saja,Positive,walkot mojokerto target 0 stunting miskin ekstrem di 2024
2023-03-23 17:31:00,Waket MPR Dorong Ramadan Jadi Momen Memperkokoh Nilai Persatuan Bangsa,Ormas Saja,Positive,waket mpr dorong ramadan jadi momen kokoh nilai satu bangsa
2023-03-08 10:30:00,Hitung Mundur Ramadhan 2023: Dua Pekan Lagi,Ormas Saja,Neutral,hitung mundur ramadhan 2023 dua pekan lagi
2023-03-22 18:56:00,"1 Ramadan 1444 Jatuh pada 23 Maret 2023, Ini Tata Cara Salat Tarawih",Ormas Saja,Neutral,1 ramadan 1444 jatuh pada 23 maret 2023 ini tata cara salat tarawih
2014-02-12 16:56:00,Puluhan Preman Ormas Digeruduk Polisi,Ormas Saja,Negative,puluh preman ormas digeruduk polisi
2023-03-15 11:25:00,Respons Menohok PDIP Balas AHY yang Kritik Pemerintah soal Wong Cilik,Ormas Saja,Negative,respons tohok pdip balas ahy yang kritik perintah soal wong cilik
2023-03-23 04:16:00,"Ramadan Dimulai Serempak 23 Maret, NU: Jadikan Momentum Persatuan Umat",Nahdlatul Ulama (NU),Positive,ramadan mulai serempak 23 maret nu jadi momentum satu umat
2023-03-26 13:24:00,Patung Bunda Maria di Kulon Progo Ditutup Terpal dan Viral,Ormas Saja,Negative,patung bunda maria di kulon progo tutup terpal dan viral
2023-03-07 09:55:00,HNW Dorong Peran Pondok Alumni Gontor Ikut Bela Umat dan Negara,Ormas Saja,Positive,hnw dorong peran pondok alumni gontor ikut bela umat dan negara
2023-03-19 15:43:00,Airlangga Terbuka Jika Cholil Nafis Ingin Gabung Golkar,Ormas Saja,Neutral,airlangga buka jika cholil naf ingin gabung golkar
2023-03-19 13:22:00,Syarief Hasan: Pemerintah Harus Tegas Sikapi Rencana Timnas Israel ke RI,Ormas Saja,Negative,syarief hasan perintah harus tegas sikap rencana timnas israel ke ri
2023-03-30 07:17:00,"HUT Ke-23,  BMI Bagikan Santunan & Bakti Sosial di Seluruh Indonesia",Ormas Saja,Positive,hut ke-23 bmi bagi santun bakti sosial di seluruh indonesia
2023-03-30 08:59:00,Ini Pihak yang Tolak Timnas Israel Hingga Indonesia Batal Gelar Piala Dunia U-20,Ormas Saja,Negative,ini pihak yang tolak timnas israel hingga indonesia batal gelar piala dunia u-20
2023-03-30 07:00:00,Mereka yang Tolak Timnas Israel Hingga RI Gagal Gelar Piala Dunia U-20,Ormas Saja,Negative,mereka yang tolak timnas israel hingga ri gagal gelar piala dunia u-20
2023-04-03 14:40:00,"Mahasiswa Papua soal Bentrokan: Yang Larang Demo PGN, Bukan Polisi",Ormas Saja,Negative,mahasiswa papua soal bentrok yang larang demo pgn bukan polisi
2014-02-10 08:53:00,Razia Miras Diwarnai Ketegangan Antara Polisi dan Puluhan Ormas,Ormas Saja,Negative,razia miras warna tegang antara polisi dan puluh ormas
2023-03-25 03:15:00,Beda Klaim Golkar-PPP soal Tokoh NU Makassar Uso Hijrah ke Partai Ka'bah,Pemuda Pancasila (PP),Negative,beda klaim golkar-ppp soal tokoh nu makassar uso hijrah ke partai ka bah
2023-03-25 01:56:00,"Tak Ada Izin Edar, Puluhan Botol Miras di Klub Malam Jaksel Disita Polisi",Ormas Saja,Negative,tak ada izin edar puluh botol miras di klub malam jaksel sita polisi
2023-02-10 10:22:00,Pilu Ribuan Pengungsi Gempa Turki Tak Punya Makanan-Air-Pemanas,Ormas Saja,Negative,pilu ribu ungsi gempa turki tak punya makanan-air-pemanas
2023-03-24 23:51:00,"Kafe Dough Lab Didatangi Polisi, Gofar Hilman Mendadak Batal Makan",Ormas Saja,Negative,kafe dough lab datang polisi gofar hilman dadak batal makan
2023-03-20 18:44:00,"Tolak Timnas Israel Main di RI, Alumni 212 Bakal Datangi Bandara Soetta",Ormas Saja,Negative,tolak timnas israel main di ri alumni 212 bakal datang bandara soetta
2023-03-20 17:28:00,Massa PA 212 Bakar Bendera Israel Saat Demo di Kawasan Patung Kuda,Persaudaraan Alumni 212 (PA 212),Negative,massa pa 212 bakar bendera israel saat demo di kawasan patung kuda
2023-03-20 17:03:00,Alasan Alumni 212 Tolak Timnas Israel Main di RI: Mereka Jajah Palestina,Ormas Saja,Negative,alas alumni 212 tolak timnas israel main di ri mereka jajah palestina
2023-02-18 09:40:00,Sederet Daerah di Jatim yang Tolak Pengajian Ustaz Hanan Attaki,Ormas Saja,Negative,deret daerah di jatim yang tolak aji ustaz hanan attaki
2023-03-23 23:12:00,"Viral Patung Bunda Maria Ditutup Terpal di Kulon Progo, Kemenag Buka Suara",Ormas Saja,Negative,viral patung bunda maria tutup terpal di kulon progo kemenag buka suara
2023-03-24 17:17:00,Kronologi Patung Bunda Maria Ditutup Terpal di Kulon Progo,Ormas Saja,Neutral,kronologi patung bunda maria tutup terpal di kulon progo
2014-02-07 07:20:00,Ormas Islam Gerebek Kelompok yang Diduga Aliran Sesat,Ormas Islam,Negative,ormas islam gerebek kelompok yang duga alir sesat
2023-01-04 22:00:00,Jabar Hari Ini: Geger Sejoli Mesum di Teras Cihampelas Bandung,Ormas Saja,Negative,jabar hari ini geger joli mesum di teras cihampelas bandung
2023-03-25 13:35:00,Penutupan Patung Bunda Maria di Jogja: Awal Mula hingga Penyebab,Nahdlatul Ulama (NU),Negative,tutup patung bunda maria di jogja awal mula hingga sebab
2023-03-27 12:01:00,Wagub Uu Buka Suara soal Video 'Hamba yang Membunuh' Calon DKM Al Jabbar,Nahdlatul Ulama (NU),Negative,wagub uu buka suara soal video hamba yang bunuh calon dkm al jabbar
2023-03-22 21:31:00,Suasana Salat Tarawih Perdana Ramadan 1444 H di Masjid Istiqlal,Ormas Saja,Neutral,suasana salat tarawih perdana ramadan 1444 h di masjid istiqlal
2023-03-01 14:39:00,Survei LSI: TNI dan Presiden Lembaga Paling Dipercaya Publik,Ormas Saja,Positive,survei lsi tni dan presiden lembaga paling percaya publik
2023-03-09 18:23:00,"Terima Kampus Pertahanan UEA, Waket MPR Bicara Konstitusi-Reformasi",Ormas Saja,Neutral,terima kampus tahan uea waket mpr bicara konstitusi-reformasi
2023-03-23 17:48:00,HNW Minta Jadwal Cuti Bersama Lebaran 2023 Dimajukan,Ormas Saja,Neutral,hnw minta jadwal cuti sama lebaran 2023 maju
2023-03-08 18:45:00,"BRIN Sebut Awal Ramadan Kemungkinan Bakal Sama, Idul Fitri Berbeda",Ormas Saja,Neutral,brin sebut awal ramadan mungkin bakal sama idul fitri beda
2023-03-17 17:31:00,Kemenag DIY Akan Amati Hilal di Bukit Syekh Belabelu Parangtritis,Ormas Saja,Neutral,kemenag diy akan amat hilal di bukit syekh belabelu parangtritis
2023-03-29 12:48:00,"Sosok AKBP Nunuk Setiyowati, Kapolres Baru Kulon Progo",Nahdlatul Ulama (NU),Neutral,sosok akbp nunuk setiyowati kapolres baru kulon progo
2014-01-29 07:49:00,Sekelompok Warga Apartemen Cempaka Mas Diserang Ormas,Ormas Saja,Negative,kelompok warga apartemen cempaka mas serang ormas
2023-03-26 03:30:00,Larangan Bukber Pejabat dan ASN Terus Tuai Kritikan,Ormas Saja,Negative,larang bukber jabat dan asn terus tuai kritik
2023-03-24 12:50:00,"Tokoh NU Makassar Uso Hijrah dari Golkar ke PPP, Diklaim Tidak Berefek",Pemuda Pancasila (PP),Neutral,tokoh nu makassar uso hijrah dari golkar ke ppp klaim tidak efek
2023-03-20 18:00:00,Ramadan 2023 Tahun Berapa Kalender Hijriah? Simak Info Lengkapnya di Sini,Ormas Saja,Neutral,ramadan 2023 tahun berapa kalender hijriah simak info lengkap di sini
