date,headline,ormas,sentiment,headline_stem
2024-02-20 14:32:00,Kemenag Pantau Hilal Tentukan Awal Ramadan di 134 Titik pada 10 Maret,Ormas Saja,Neutral,kemenag pantau hilal tentu awal ramadan di 134 titik pada 10 maret
2024-01-25 12:17:00,"Aktivis Karimunjawa Ditahan Lagi, Kawali Jateng Kembali Ajukan Penangguhan",Ormas Saja,Negative,aktivis karimunjawa tahan lagi kawal jateng kembali aju tangguh
2024-03-28 08:45:00,Bagaimana Hukum Puasa Jika Sudah Ada yang Lebaran? Ini Penjelasannya,Ormas Saja,Neutral,bagaimana hukum puasa jika sudah ada yang lebaran ini jelas
2024-09-01 06:30:00,Profil Ujang Endin-Dadang Solihat Paslon di Pilbup Pangandaran 2024,Ormas Saja,Neutral,profil ujang endin-dadang solihat paslon di pilbup pangandaran 2024
2024-03-27 19:44:00,"Kapolsek Mampang Bukber Bareng Warga Slum Area, Santuni Anak Yatim",Ormas Saja,Positive,kapolsek mampang bukber bareng warga slum area santun anak yatim
2024-05-24 15:01:00,"Bamsoet: Papua Punya Potensi Ekonomi Besar, tapi Belum Digarap Maksimal",Ormas Saja,Neutral,bamsoet papua punya potensi ekonomi besar tapi belum garap maksimal
2022-03-27 15:06:00,Mandagri Imbau Ormas Ajak Warga untuk Tak Golput,Ormas Saja,Neutral,mandagri imbau ormas ajak warga untuk tak golput
2023-11-21 19:04:00,Polisi Tangkap 5 Orang Buntut Ricuh Pembongkaran Lapak di Bogor,Ormas Saja,Negative,polisi tangkap 5 orang buntut ricuh bongkar lapak di bogor
2024-03-26 01:30:00,Mau Bayar Zakat Fitrah Pakai Beras di Aceh Besar? Ini Besarannya,Ormas Saja,Neutral,mau bayar zakat fitrah pakai beras di aceh besar ini besar
2023-11-07 09:30:00,Berkas Perkara 2 Anggota PP Geruduk Mie Gacoan Segera Diberi ke Jaksa,Pemuda Pancasila (PP),Negative,berkas perkara 2 anggota pp geruduk mie gaco segera beri ke jaksa
2013-05-11 15:58:00,Dialog Nasional Menjaga Keutuhan NKRI,Ormas Saja,Positive,dialog nasional jaga utuh nkri
2023-11-21 16:00:00,Pemkab Minta Polisi Usut Tuntas Ricuh Pembongkaran Lapak di Bogor,Ormas Saja,Negative,pemkab minta polisi usut tuntas ricuh bongkar lapak di bogor
2023-11-06 19:15:00,"Bertemu Surya Paloh, Din Syamsuddin dan Rombongan Dukung Anies-Cak Imin",Ormas Saja,Neutral,temu surya paloh din syamsuddin dan rombong dukung anies-cak imin
2023-10-26 15:15:00,Din Syamsuddin: Saya Haqqul Yakin Warga Muhammadiyah Dukung Anies-Cak Imin,Muhammadiyah,Neutral,din syamsuddin saya haqqul yakin warga muhammadiyah dukung anies-cak imin
2023-10-26 13:01:00,"Kemenag Tolak Izin Pertemuan Nasional Ahmadiyah di Boyolali, Ini Alasannya",Ormas Saja,Negative,kemenag tolak izin temu nasional ahmadiyah di boyolali ini alas
2024-05-21 17:33:00,Ketua PCNU Kulon Progo Daftar Bacawabup di PDIP,Nahdlatul Ulama (NU),Neutral,ketua pcnu kulon progo daftar bacawabup di pdip
2024-01-20 17:15:00,Ribuan Anggota GRIB Jaya Jatim Deklarasi Dukung Prabowo-Gibran,Gerakan Rakyat Indonesia Bersatu (GRIB),Neutral,ribu anggota grib jaya jatim deklarasi dukung prabowo-gibran
2023-12-24 18:57:00,"Tinjau 3 Gereja di Jakarta, Kapolri Bicara Keberagaman, Jaga Persatuan-Kesatuan",Ormas Saja,Positive,tinjau 3 gereja di jakarta kapolri bicara agam jaga satu
2022-03-06 20:43:00,"Ormas di Pekanbaru Ribut-ribut di Lokasi Acara, Piring Beterbangan",Ormas Saja,Negative,ormas di pekanbaru ribut di lokasi acara piring bangan
2023-12-24 18:52:00,"Kapolri, Menko PMK, dan Heru Budi Sambangi Gereja Immanuel Jakarta",Nahdlatul Ulama (NU),Positive,kapolri menko pmk dan heru budi sambang gereja immanuel jakarta
2023-10-25 19:45:00,Anggota PP Berulang Kali Geruduk Mie Gacoan di Medan Minta Kelola Parkir,Pemuda Pancasila (PP),Negative,anggota pp ulang kali geruduk mie gaco di medan minta kelola parkir
2024-05-20 18:57:00,Bamsoet Dorong Pengusaha Nasional Tingkatkan Perekonomian,Ormas Saja,Positive,bamsoet dorong usaha nasional tingkat ekonomi
2013-04-12 20:20:00,Diskusi Peran Ormas Dongkrak Suara Parpol,Ormas Saja,Neutral,diskusi peran ormas dongkrak suara parpol
2023-10-25 18:12:00,Kemenag Tolak Izin Pertemuan Nasional Tahunan Ahmadiyah di Boyolali,Ormas Saja,Negative,kemenag tolak izin temu nasional tahun ahmadiyah di boyolali
2023-12-24 10:20:00,"Milad ke-93 Al Washliyah, Dedi Iskandar: Terima Kasih, Perjuangkan Aset Umat",Ormas Saja,Positive,milad ke-93 al washliyah dedi iskandar terima kasih juang aset umat
2024-04-16 15:00:00,Pamit Terakhir Salman Sebelum Ditemukan Jadi Kerangka di Hutan Jati,Ormas Saja,Negative,pamit akhir salman belum temu jadi kerangka di hutan jati
2024-05-19 18:41:00,Bamsoet Puji Kiprah Politik Akbar Tandjung: Mentor dan Guru Terbaik,Ormas Saja,Positive,bamsoet puji kiprah politik akbar tandjung mentor dan guru baik
2024-01-19 13:15:00,"30 Link Twibbon Harlah NU 2024 ke-101, Gratis dan Bisa Dipasang di Medsos",Nahdlatul Ulama (NU),Neutral,30 link twibbon harlah nu 2024 ke-101 gratis dan bisa pasang di medsos
2024-08-23 18:23:00,"Demo Revisi UU Pilkada, Mahasiswa Cimahi-Majalengka Bakar Ban",Ormas Saja,Negative,demo revisi uu pilkada mahasiswa cimahi-majalengka bakar ban
2023-12-23 20:47:00,4.041 Personel Polisi Amankan 1.807 Gereja di Jakarta Saat Ibadah Natal,Ormas Saja,Neutral,4 041 personel polisi aman 1 807 gereja di jakarta saat ibadah natal
2018-12-28 18:38:00,Konjen China Didemo Ormas Islam Surabaya,Ormas Islam,Negative,konjen china demo ormas islam surabaya
2023-12-02 17:33:00,Polisi Tangkap Terduga Provokator Bentrok di Bitung,Ormas Saja,Negative,polisi tangkap duga provokator bentrok di bitung
2024-01-17 19:24:00,"Masih Ada Ortu Tolak Imunisasi Polio di Jateng, Ini Respons Dinkes",Ormas Saja,Negative,masih ada ortu tolak imunisasi polio di jateng ini respons dinkes
2024-01-17 12:49:00,Catat! Knalpot Brong Dilarang Selama Kampanye Akbar di Jogja,Ormas Saja,Neutral,catat knalpot brong larang lama kampanye akbar di jogja
2013-04-12 17:30:00,Muhammadiyah Aksi Menolak RUU Ormas,Muhammadiyah,Negative,muhammadiyah aksi tolak ruu ormas
2024-02-11 10:41:00,Ahmed Zaki Ajak Warga DKI Beri Hak Suara demi Demokrasi Berkualitas,Ormas Saja,Positive,ahmed zaki ajak warga dki beri hak suara demi demokrasi kualitas
2023-12-21 13:01:00,"Jelang Natal, Kapolri Perintahkan Jajaran Sterilisasi Tempat Ibadah",Ormas Saja,Neutral,jelang natal kapolri perintah jajar sterilisasi tempat ibadah
2023-12-21 13:40:00,DPP CMMI Batal Laporkan Zulhas soal Penistaan Agama ke Polisi,Pemuda Pancasila (PP),Neutral,dpp cmmi batal lapor zulhas soal nista agama ke polisi
2024-03-18 16:15:00,Kapan Lebaran 2024? Ini Perkiraan Tanggal Pemerintah dan Muhammadiyah,Muhammadiyah,Neutral,kapan lebaran 2024 ini kira tanggal perintah dan muhammadiyah
2024-03-18 15:04:00,"Sekdes di Pekalongan Diduga Selingkuh, Ratusan Warga Geruduk Balai Desa",Ormas Saja,Negative,sekdes di kalong duga selingkuh ratus warga geruduk balai desa
2024-05-14 13:19:00,Kemenag Targetkan Sertifikasi Tanah Wakaf Beres pada 2026,Ormas Saja,Neutral,kemenag target sertifikasi tanah wakaf beres pada 2026
2024-02-09 21:02:00,NU Dan Muhammadiyah Harap Pilpres 2024 Kondusif: Terima Apapun Hasilnya,Nahdlatul Ulama (NU),Positive,nu dan muhammadiyah harap pilpres 2024 kondusif terima apa hasil
2018-12-01 12:01:00,Demo Mahasiswa Papua Dihadang Polisi dan Ormas,Ormas Saja,Negative,demo mahasiswa papua dihadang polisi dan ormas
2024-02-08 21:10:00,Fahira Idris Sebut Imlek Jadi Berkah Bagi Pedagang Bandeng di Rawa Belong,Ormas Saja,Positive,fahira idris sebut imlek jadi berkah bagi dagang bandeng di rawa bong
2024-05-12 22:30:00,Khofifah Ajak Kader Muslimat Wujudkan Zero Stunting,Ormas Saja,Positive,khofifah ajak kader muslimat wujud zero stunting
2023-10-25 14:55:00,Polisi Pastikan Anggota PP Geruduk Mie Gacoan di Medan Minta Kelola Parkir,Pemuda Pancasila (PP),Negative,polisi pasti anggota pp geruduk mie gaco di medan minta kelola parkir
2013-04-12 16:48:00,2 Mahasiswa Uhamka Tembus Pagar DPR,Ormas Saja,Negative,2 mahasiswa uhamka tembus pagar dpr
2024-08-14 13:18:00,"Profil KH Ali Manshur, Pencipta Sholawat Badar yang Diberi Tanda Kehormatan",Ormas Saja,Positive,profil kh ali manshur cipta sholawat badar yang beri tanda hormat
2023-11-28 21:36:00,"Libatkan Tentara, Wali Kota Denpasar Minta Penyerang Satpol PP Ditindak Tegas",Pemuda Pancasila (PP),Negative,libat tentara wali kota denpasar minta serang satpol pp tindak tegas
2023-11-01 07:25:00,2 Anggota PP Tersangka Geruduk Mie Gacoan di Medan Ditangkap!,Pemuda Pancasila (PP),Negative,2 anggota pp sangka geruduk mie gaco di medan tangkap
2024-03-15 10:35:00,Akun Facebook Pria Hina Islam Catut Foto Eks Walkot Sukabumi,Ormas Saja,Negative,akun facebook pria hina islam catut foto eks walkot sukabumi
2024-01-13 11:23:00,"Massa Demo Bela Palestina Depan Kedubes AS Bubar, Lalin Dibuka Kembali",Ormas Saja,Neutral,massa demo bela palestina depan dubes as bubar lalin buka kembali
2024-03-14 12:36:00,Gebyar Ramadhan Blora 2024 Sajikan Stand Kuliner hingga Fashion,Ormas Saja,Positive,gebyar ramadhan blora 2024 saji stand kuliner hingga fashion
2023-11-27 23:11:00,Menag soal Bentrokan di Bitung: Agama Jangan Dijadikan Sumber Perpecahan,Ormas Saja,Negative,menag soal bentrok di bitung agama jangan jadi sumber pecah
2018-11-17 14:48:00,14 Ormas Islam Minta Bendera Tauhid Tak Dijadikan Alat Kampanye,Ormas Islam,Neutral,14 ormas islam minta bendera tauhid tak jadi alat kampanye
2024-02-06 19:14:00,"Persatuan Ummat Islam Temui Jokowi di Istana Merdeka, Apa yang Dibahas?",Ormas Saja,Neutral,satu ummat islam temu jokowi di istana merdeka apa yang bahas
2024-02-06 14:43:00,"Dukungan 02 di Lahat Menggeliat, Barisan RFG Adakan Tebus Murah Sembako",Ormas Saja,Positive,dukung 02 di lahat geliat baris rfg adakan tebus murah sembako
2023-11-27 11:31:00,Kapolri Imbau Warga Hindari Provokasi Usai Bentrokan di Bitung,Ormas Saja,Negative,kapolri imbau warga hindar provokasi usai bentrok di bitung
2013-04-11 15:05:00,Spanduk Berantas Premanisme Bertebaran di Yogya,Ormas Saja,Negative,spanduk berantas preman tebar di yogya
2023-11-27 07:11:00,Pimpinan Komisi VIII DPR Harap Semua Pihak Tahan Diri Usai Bentrok di Bitung,Ormas Saja,Negative,pimpin komisi viii dpr harap semua pihak tahan diri usai bentrok di bitung
2024-02-05 22:04:00,"Golkar Gelar Tadarus Al-Qur'an, Airlangga Harap Suasana Teduh Jelang Pemilu",Ormas Saja,Positive,golkar gelar tadarus al-qur an airlangga harap suasana teduh jelang milu
2023-11-04 06:29:00,Serba-serbi Aksi Bela Palestina 5 November di Monas,Ormas Saja,Neutral,serba-serbi aksi bela palestina 5 november di monas
2024-01-18 15:33:00,Dedi Iskandar Dorong Kader Dukung Caleg dari Al-Washliyah di Pemilu 2024,Ormas Saja,Neutral,dedi iskandar dorong kader dukung caleg dari al-washliyah di milu 2024
2023-11-27 00:43:00,"Muspinas II, Kosgoro 1957 Mantapkan Pemenangan Prabowo-Gibran di 2024",Ormas Saja,Neutral,muspinas ii kosgoro 1957 mantap menang prabowo-gibran di 2024
2024-01-11 16:48:00,Husen Pemutilasi Bos Air Isi Ulang Semarang Divonis 20 Tahun Bui,Ormas Saja,Negative,husen mutilasi bos air isi ulang semarang vonis 20 tahun bui
2023-11-26 14:58:00,"Bentrok di Bitung, Ketua Komisi VIII DPR: Hindari Propaganda Pecah Belah",Ormas Saja,Negative,bentrok di bitung ketua komisi viii dpr hindar propaganda pecah belah
2018-11-09 11:07:00,Wiranto Bahas Pembakaran Bendera HTI Bareng Pimpinan Ormas,Hizbut Tahrir Indonesia (HTI),Negative,wiranto bahas bakar bendera hti bareng pimpin ormas
2023-11-26 11:15:00,Kemenag Minta Semua Pihak Tak Terprovokasi soal Bentrokan di Bitung Sulut,Ormas Saja,Negative,kemenag minta semua pihak tak provokasi soal bentrok di bitung sulut
2023-11-26 11:42:00,"Kericuhan Kelompok Massa di Bitung Sulut, 1 Orang Tewas-2 Terluka",Ormas Saja,Negative,ricuh kelompok massa di bitung sulut 1 orang tewas-2 luka
2023-11-26 07:35:00,"Viral Aksi Bela Palestina Ricuh Berujung Bentrok di Bitung, Begini Faktanya",Ormas Saja,Negative,viral aksi bela palestina ricuh ujung bentrok di bitung begini fakta
2013-04-10 13:11:00,Ribuan Buruh Padati Jalan Thamrin,Ormas Saja,Neutral,ribu buruh padat jalan thamrin
2024-03-11 18:01:00,Pinta Bey Agar Tempat Hiburan Malam Tak Beroperasi Saat Ramadan,Ormas Saja,Neutral,pinta bey agar tempat hibur malam tak operasi saat ramadan
2024-03-11 16:44:00,Bamsoet Apresiasi Perolehan Suara Golkar: Hasil Kerja Cerdas Seluruh Kader,Ormas Saja,Positive,bamsoet apresiasi oleh suara golkar hasil kerja cerdas seluruh kader
2023-11-26 00:30:00,"Bentrok di Bitung Sempat Terjadi di Beberapa Lokasi, Situasi Mulai Kondusif",Ormas Saja,Negative,bentrok di bitung sempat jadi di beberapa lokasi situasi mulai kondusif
2024-03-13 04:01:00,Kata PBNU hingga Muhammadiyah soal Aturan Speaker Masjid dari Kemenag,Nahdlatul Ulama (NU),Neutral,kata pbnu hingga muhammadiyah soal atur speaker masjid dari kemenag
2023-11-25 21:06:00,"Viral Video Ribut-ribut Dua Massa di Bitung, Ini Kata Kapolda Sulut",Ormas Saja,Negative,viral video ribut dua massa di bitung ini kata kapolda sulut
2024-08-07 17:20:00,Ayah Sebut Pelaku Pembacokan Sempat Ribut dengan Anggota TNI di Diskotek,Ormas Saja,Negative,ayah sebut laku baco sempat ribut dengan anggota tni di diskotek
2023-05-19 23:30:00,Nasib Pria Berbaju Ormas Rudi Boy Usai Palak Sopir di Bogor,Ormas Saja,Negative,nasib pria baju ormas rudi boy usai palak sopir di bogor
2018-11-02 20:44:00,"Soal Pembakaran Bendera, Wiranto Akan Kumpulkan Ormas Islam",Ormas Islam,Negative,soal bakar bendera wiranto akan kumpul ormas islam
2024-08-07 11:25:00,Fakta Pengajian KH Imaduddin di Gresik Tak Berizin-Panitia Diperiksa Polisi,Ormas Saja,Negative,fakta aji kh imaduddin di gresik tak berizin-panitia periksa polisi
2024-03-10 20:11:00,"Hasil Sidang Isbat 2024, Apakah 11 Maret Mulai Puasa Ramadhan?",Ormas Saja,Neutral,hasil sidang isbat 2024 apakah 11 maret mulai puasa ramadhan
2024-03-10 18:17:00,"Posisi Hilal di Makassar Tidak Terlihat karena Mendung, Ketinggian 0 Derajat",Ormas Saja,Neutral,posisi hilal di makassar tidak lihat karena mendung tinggi 0 derajat
2013-04-09 14:56:00,Aktivis Yogya Tolak RUU Ormas,Ormas Saja,Negative,aktivis yogya tolak ruu ormas
2024-03-10 17:56:00,Sidang Isbat Mulai Jam Berapa? Ini Jadwal dan Link Streaming-nya,Ormas Saja,Neutral,sidang isbat mulai jam berapa ini jadwal dan link streaming-nya
2024-03-10 14:24:00,Sidang Isbat Awal Ramadhan 2024 Mulai Jam Berapa? Cek Jadwalnya di Sini,Ormas Saja,Neutral,sidang isbat awal ramadhan 2024 mulai jam berapa cek jadwal di sini
2024-03-10 11:10:00,"Tahapan dan Pengumuman Hasil Sidang Isbat 2024, Cek di Sini",Ormas Saja,Neutral,tahap dan umum hasil sidang isbat 2024 cek di sini
2024-03-09 17:46:00,"Sidang Isbat Ramadan 2024: Jadwal, Tahapan dan Link Live Streaming",Ormas Saja,Neutral,sidang isbat ramadan 2024 jadwal tahap dan link live streaming
2024-03-09 12:23:00,Link Live Streaming Sidang Isbat Awal Ramadhan 2024 serta Jadwalnya,Ormas Saja,Neutral,link live streaming sidang isbat awal ramadhan 2024 serta jadwal
2024-03-09 11:00:00,"Jadwal-Link Streaming Sidang Isbat 1 Ramadan 2024, Lengkap Libur Awal Puasa",Ormas Saja,Neutral,jadwal-link streaming sidang isbat 1 ramadan 2024 lengkap libur awal puasa
2024-03-10 18:52:00,Hasil Rukyatul Hilal Penetapan 1 Ramadhan 1445 H di Indonesia Timur-Tengah,Ormas Saja,Neutral,hasil rukyatul hilal tetap 1 ramadhan 1445 h di indonesia timur-tengah
2018-10-27 00:48:00,Ini Pernyataan Sikap Bersama Sejumlah Ormas Islam di Kediaman JK,Ormas Islam,Neutral,ini nyata sikap sama jumlah ormas islam di diam jk
2024-03-08 19:14:00,"Kapan Puasa Ramadan 2024? Ini Jadwalnya versi Pemerintah, NU, dan Muhammadiyah",Nahdlatul Ulama (NU),Neutral,kapan puasa ramadan 2024 ini jadwal versi perintah nu dan muhammadiyah
2024-03-08 19:00:00,Ramadhan 2024 Tahun Berapa Hijriah? Simak Penjelasannya Yuk!,Ormas Saja,Neutral,ramadhan 2024 tahun berapa hijriah simak jelas yuk
2024-05-03 12:16:00,Pesan Warga Sukabumi untuk Bank Emok Lewat 'Selembar' Spanduk,Ormas Saja,Negative,pesan warga sukabumi untuk bank emok lewat lembar spanduk
2013-04-08 18:37:00,Kemendagri Diprotes Soal RUU Ormas,Ormas Saja,Negative,kemendagri protes soal ruu ormas
2024-03-08 13:38:00,PHDI Undang Presiden Jokowi Hadiri Puncak Perayaan Nyepi Nasional 2024,Ormas Saja,Positive,phdi undang presiden jokowi hadir puncak raya nyepi nasional 2024
2024-03-08 12:14:00,Prediksi BRIN: Hilal Ramadan Tak Terlihat pada 10 Maret Magrib,Gerakan Rakyat Indonesia Bersatu (GRIB),Neutral,prediksi brin hilal ramadan tak lihat pada 10 maret magrib
2023-05-15 13:14:00,Viral Pemotor Dikerubungi Massa Ormas di Bekasi gegara Knalpot,Ormas Saja,Negative,viral motor rubung massa ormas di bekas gegara knalpot
2024-05-02 19:08:00,"Bamsoet: Diminta atau Tidak, SOKSI Siap Sukseskan Pemerintahan Prabowo",Ormas Saja,Positive,bamsoet minta atau tidak soksi siap sukses perintah prabowo
2024-03-07 17:45:00,Kapan Jadwal Sidang Isbat 1 Ramadan 2024? Cek Tanggal dan Link Streamingnya,Ormas Saja,Neutral,kapan jadwal sidang isbat 1 ramadan 2024 cek tanggal dan link streamingnya
2024-03-07 14:23:00,"Jadwal Sidang Isbat Awal Ramadhan 2024, Cek Tanggalnya di Sini",Ormas Saja,Neutral,jadwal sidang isbat awal ramadhan 2024 cek tanggal di sini
2018-10-26 21:22:00,Ma'ruf Amin hingga Kapolri Ikut Rapat Ormas Islam Bareng JK,Ormas Islam,Neutral,ma ruf amin hingga kapolri ikut rapat ormas islam bareng jk
2024-03-07 10:12:00,Ramadan 2024 Tahun Berapa Hijriah? Cek Info dan Penentuan Awal Bulannya,Ormas Saja,Neutral,ramadan 2024 tahun berapa hijriah cek info dan tentu awal bulan
2024-01-31 12:30:00,"Hari Terakhir Pembukaan Lowongan 500 Dai Bulan Ramadan, Daftar di Sini!",Ormas Saja,Neutral,hari akhir buka lowong 500 dai bulan ramadan daftar di sini
2023-12-04 06:34:00,Pelarian Terduga Provokator Bentrok di Bitung Berakhir di Kalimantan,Ormas Saja,Negative,lari duga provokator bentrok di bitung akhir di kalimantan
2013-04-05 15:52:00,HTI Tolak RUU Ormas,Hizbut Tahrir Indonesia (HTI),Negative,hti tolak ruu ormas
2024-03-06 15:32:00,Duh! Ada Pungli Saat Buang Sampah ke TPAS Cianjur yang Baru,Ormas Saja,Negative,duh ada pungli saat buang sampah ke tpas cianjur yang baru
2024-07-31 18:45:00,Catat! Ini Kata MUI soal Kriteria Produk Terafiliasi Israel buat Dihindari,Ormas Saja,Neutral,catat ini kata mui soal kriteria produk afiliasi israel buat hindar
2024-01-30 18:00:00,"PTN Konghucu Pertama di RI Dibangun Mulai Juli 2024, Bakal Ada 3 Prodi Ini",Ormas Saja,Positive,ptn konghucu pertama di ri bangun mulai juli 2024 bakal ada 3 prodi ini
2024-03-06 10:21:00,Jadwal Sidang Isbat Penentuan 1 Ramadan 2024 dan Link Live Streaming-nya,Ormas Saja,Neutral,jadwal sidang isbat tentu 1 ramadan 2024 dan link live streaming-nya
2024-07-31 06:32:00,Alasan di Balik Jokowi Ajak Influencer 'Ngaspal' di IKN,Ormas Saja,Neutral,alas di balik jokowi ajak influencer ngaspal di ikn
2023-05-19 10:43:00,5 Fakta Sosok Pria Berseragam Ormas Pemalak Sopir Truk di Bogor,Ormas Saja,Negative,5 fakta sosok pria seragam ormas malak sopir truk di bogor
2023-05-19 14:30:00,"Rudi Boy Berbaju Ormas Palak Sopir, Dapat Rp 90 Ribu dalam Sehari",Ormas Saja,Negative,rudi boy baju ormas palak sopir dapat rp 90 ribu dalam hari
2018-10-03 20:06:00,Ismaya Bantah DWP Pindah ke Bali karena Ancaman Ormas,Ormas Saja,Negative,ismaya bantah dwp pindah ke bal karena ancam ormas
2024-01-29 11:08:00,"Hadiri Harlah ke-101 NU di Krapyak, Yenny Wahid Harap NU Jaga Netralitas",Nahdlatul Ulama (NU),Neutral,hadir harlah ke-101 nu di krapyak yenny wahid harap nu jaga netralitas
2024-07-29 07:50:00,Curiga Gus Yahya soal Pansus Haji Masalah Pribadi Dijawab PKB,Ormas Saja,Neutral,curiga gus yahya soal pansus haji masalah pribadi jawab pkb
2024-03-03 19:29:00,MUI Harap PPP Terus Berkiprah di Parlemen Mewakili Aspirasi Umat Islam,Pemuda Pancasila (PP),Positive,mui harap ppp terus kiprah di parlemen wakil aspirasi umat islam
2013-04-04 15:47:00,NU Minta RUU Ormas Ditunda Jadi Undang-undang,Nahdlatul Ulama (NU),Negative,nu minta ruu ormas tunda jadi undang
2024-01-27 20:51:00,TKN soal Dana Abadi Pesantren: Supaya Santri Tak Dipandang Sebelah Mata,Ormas Saja,Positive,tkn soal dana abadi pesantren supaya santri tak pandang belah mata
2024-04-25 20:10:00,Eksepsi Terdakwa Kredit Bank Banten Sebut Dakwaan Tak Cermat,Ormas Saja,Neutral,eksepsi dakwa kredit bank banten sebut dakwa tak cermat
2024-01-26 17:38:00,Ketua Muslimat Jatim Minta Kader Ikuti Pilihan Politik Khofifah,Ormas Saja,Neutral,ketua muslimat jatim minta kader ikut pilih politik khofifah
2024-01-26 14:45:00,"Seleksi PPIH Arab Saudi Diikuti Ribuan Peserta, Tesnya Berbasis Digital",Pemuda Pancasila (PP),Neutral,seleksi ppih arab saudi ikut ribu serta tes bas digital
2023-11-19 10:00:00,Ribuan Warga Gelar Aksi Damai Bela Palestina di Alun-alun Sidoarjo,Ormas Saja,Positive,ribu warga gelar aksi damai bela palestina di alun sidoarjo
2023-11-09 17:59:00,"Din Syamsuddin Dukung Anies-Cak Imin, PP Muhammadiyah: Itu Hak Politik",Pemuda Pancasila (PP),Neutral,din syamsuddin dukung anies-cak imin pp muhammadiyah itu hak politik
2018-09-03 18:35:00,"Y-Publica: 21,3% FPI Memilih Jokowi",Front Pembela Islam (FPI),Neutral,y-publica 21 3 fpi pilih jokowi
2024-07-23 23:16:00,LBH Duga Oknum TNI Jadi Otak Pelaku Pembakaran Rumah Wartawan di Karo,Nahdlatul Ulama (NU),Negative,lbh duga oknum tni jadi otak laku bakar rumah wartawan di karo
2024-01-25 19:09:00,"GRIB Jaya Deklarasi Dukungan ke Prabowo, Hercules: Dukung Calon Lain Pecat",Gerakan Rakyat Indonesia Bersatu (GRIB),Neutral,grib jaya deklarasi dukung ke prabowo hercules dukung calon lain pecat
2023-10-23 12:10:00,2 Orang Jadi Tersangka Kasus Anggota PP Geruduk Mie Gacoan di Medan,Pemuda Pancasila (PP),Negative,2 orang jadi sangka kasus anggota pp geruduk mie gaco di medan
2013-03-28 17:00:00,Muhammadiyah Tolak RUU Ormas,Muhammadiyah,Negative,muhammadiyah tolak ruu ormas
2024-07-22 12:55:00,Bos PPI Ungkap 3 Fase Metamorfosis Wajah Politik Anies Baswedan,Pemuda Pancasila (PP),Neutral,bos ppi ungkap 3 fase metamorfosis wajah politik anies baswedan
2024-07-22 09:01:00,Beda Mad Ali dan Sohibul Iman soal 'Ceruk dan Habitat' Anies,Ormas Saja,Neutral,beda mad ali dan sohibul iman soal ceruk dan habitat anies
2024-07-22 08:55:00,"PKB Bela Anies: Dia Warga Jakarta, Wajar Beri Saran dan Kritik",Ormas Saja,Neutral,pkb bela anies dia warga jakarta wajar beri saran dan kritik
2024-02-28 14:00:00,Kapan Sidang Isbat Ramadan 2024? Catat Jadwal Lengkapnya!,Ormas Saja,Neutral,kapan sidang isbat ramadan 2024 catat jadwal lengkap
2024-02-28 10:35:00,Hari Terakhir Syaban dan Awal Puasa Ramadhan 2024 Tanggal Berapa?,Ormas Saja,Neutral,hari akhir syaban dan awal puasa ramadhan 2024 tanggal berapa
2023-09-19 17:57:00,"Survei Pemilih NU di LSI Denny JA: Prabowo 36,2%, Ganjar 35,5%, Anies 17,9%",Nahdlatul Ulama (NU),Neutral,survei pilih nu di lsi denny ja prabowo 36 2 ganjar 35 5 anies 17 9
2024-02-27 15:39:00,Hari Terakhir Syaban dan Awal Puasa Ramadhan 2024 Tanggal Berapa?,Ormas Saja,Neutral,hari akhir syaban dan awal puasa ramadhan 2024 tanggal berapa
2018-08-23 12:09:00,"Tak Hanya Golkar, Sandi Juga Safari Politik ke Ormas Islam",Ormas Islam,Neutral,tak hanya golkar sandi juga safari politik ke ormas islam
2024-04-20 12:59:00,"Kabupaten Bandung Rayakan Hari Jadi Ke-383, Ini Capaian Prestasinya",Ormas Saja,Positive,kabupaten bandung raya hari jadi ke-383 ini capai prestasi
2024-02-26 12:30:00,Kapan Sidang Isbat Ramadhan 2024? Ini Tanggalnya,Ormas Saja,Neutral,kapan sidang isbat ramadhan 2024 ini tanggal
2023-11-03 16:37:00,"PKB Sebut Din Syamsuddin Lebih dari Tim Pemenangan AMIN, Apa Maksudnya?",Ormas Saja,Neutral,pkb sebut din syamsuddin lebih dari tim menang amin apa maksud
2013-03-28 16:43:00,Gelombang Protes Anti-RUU Ormas,Ormas Saja,Negative,gelombang protes anti-ruu ormas
2023-12-29 20:45:00,"Abdul Mu'ti soal Demokrasi Indonesia: Seperti Zombi, Berjalan Tanpa Ruh",Ormas Saja,Negative,abdul mu ti soal demokrasi indonesia seperti zombi jalan tanpa ruh
2024-04-19 10:58:00,2 Eks Pejabat Bank Banten Didakwa Korupsi Kasus Kredit Rp 782 Juta,Ormas Saja,Negative,2 eks jabat bank banten dakwa korupsi kasus kredit rp 782 juta
2024-02-25 13:40:00,Awal Puasa Ramadhan 2024 Berapa Hari Lagi? Ini Hitung Mundurnya,Ormas Saja,Neutral,awal puasa ramadhan 2024 berapa hari lagi ini hitung mundur
2024-02-25 12:13:00,Kapan Puasa Ramadan Dimulai? Cek Jadwal Sidang Isbat di Sini,Ormas Saja,Neutral,kapan puasa ramadan mulai cek jadwal sidang isbat di sini
2023-05-18 18:35:00,Prabowo Sebut Ada Ormas Anggotanya Cuma 11 Orang: Lebih Baik Remaja Masjid,Ormas Saja,Neutral,prabowo sebut ada ormas anggota cuma 11 orang lebih baik remaja masjid
2024-02-24 20:21:00,Hasil Analisis BMKG soal Prakiraan Hilal Awal Ramadan 2024,Ormas Saja,Neutral,hasil analisis bmkg soal prakira hilal awal ramadan 2024
2024-02-26 08:25:00,Imbauan dari PBNU-Muhammadiyah Jika Terjadi Perbedaan Awal Ramadan,Nahdlatul Ulama (NU),Neutral,imbau dari pbnu-muhammadiyah jika jadi beda awal ramadan
2018-08-16 15:36:00,"Tifatul Puji Mahfud, Tapi Sesalkan Ada Politisasi Ormas Islam",Ormas Islam,Negative,tifatul puji mahfud tapi sesal ada politisasi ormas islam
2024-02-23 20:20:00,"1 Ramadhan 2024 Kapan? Ini Jadwal Versi Pemerintah, NU, dan Muhammadiyah",Nahdlatul Ulama (NU),Neutral,1 ramadhan 2024 kapan ini jadwal versi perintah nu dan muhammadiyah
2024-02-22 13:14:00,Menko Polhukam Hadi Tjahjanto Ajak PBNU Jaga Kondusivitas Usai Pemilu 2024,Nahdlatul Ulama (NU),Positive,menko polhukam had tjahjanto ajak pbnu jaga kondusivitas usai milu 2024
2025-03-30 17:30:00,Masjid Istiqlal Siap Tampung 150 Ribu Jemaah Salat Idul Fitri Besok,Ormas Saja,Neutral,masjid istiqlal siap tampung 150 ribu jemaah salat idul fitri besok
2013-03-22 14:51:00,Ormas Islam Surabaya Minta Densus 88 Dibubarkan,Ormas Islam,Negative,ormas islam surabaya minta densus 88 bubar
2023-11-03 17:58:00,HNW Sebut Aksi Bela Palestina di Monas Akan Dihadiri 2 Juta Orang,Ormas Saja,Neutral,hnw sebut aksi bela palestina di monas akan hadir 2 juta orang
2024-07-10 13:25:00,"Kapan Puasa Asyura 2024? Cek Jadwal Versi NU, Pemerintah, dan Muhammadiyah",Nahdlatul Ulama (NU),Neutral,kapan puasa asyura 2024 cek jadwal versi nu perintah dan muhammadiyah
